18:52:57.328263 IP 10.244.0.6.59040 > kube-dns.kube-system.svc.cluster.local.53: 17531+ [1au] A? www.google.com.default.svc.cluster.local. (81)
18:52:57.328320 IP 10.244.0.6.59040 > kube-dns.kube-system.svc.cluster.local.53: 30412+ [1au] AAAA? www.google.com.default.svc.cluster.local. (81)
18:52:57.328686 IP kube-dns.kube-system.svc.cluster.local.53 > 10.244.0.6.59040: 30412 NXDomain*- 0/1/1 (174)
18:52:57.328717 IP kube-dns.kube-system.svc.cluster.local.53 > 10.244.0.6.59040: 17531 NXDomain*- 0/1/1 (174)
18:52:57.328761 IP 10.244.0.6.59040 > kube-dns.kube-system.svc.cluster.local.53: 63252+ [1au] A? www.google.com.svc.cluster.local. (61)
18:52:57.328780 IP 10.244.0.6.59040 > kube-dns.kube-system.svc.cluster.local.53: 50887+ [1au] AAAA? www.google.com.svc.cluster.local. (61)
18:52:57.328857 IP kube-dns.kube-system.svc.cluster.local.53 > 10.244.0.6.59040: 50887 NXDomain*- 0/1/1 (154)
18:52:57.328879 IP kube-dns.kube-system.svc.cluster.local.53 > 10.244.0.6.59040: 63252 NXDomain*- 0/1/1 (154)
18:52:57.328955 IP 10.244.0.6.59040 > kube-dns.kube-system.svc.cluster.local.53: 11682+ [1au] A? www.google.com.cluster.local. (57)
18:52:57.328981 IP 10.244.0.6.59040 > kube-dns.kube-system.svc.cluster.local.53: 48118+ [1au] AAAA? www.google.com.cluster.local. (57)
18:52:57.329011 IP kube-dns.kube-system.svc.cluster.local.53 > 10.244.0.6.59040: 11682 NXDomain*- 0/1/1 (150)
18:52:57.329042 IP kube-dns.kube-system.svc.cluster.local.53 > 10.244.0.6.59040: 48118 NXDomain*- 0/1/1 (150)
18:52:57.329071 IP 10.244.0.6.59040 > kube-dns.kube-system.svc.cluster.local.53: 29423+ [1au] A? www.google.com. (43)
18:52:57.329081 IP 10.244.0.6.59040 > kube-dns.kube-system.svc.cluster.local.53: 60374+ [1au] AAAA? www.google.com. (43)
18:52:57.329099 IP kube-dns.kube-system.svc.cluster.local.53 > 10.244.0.6.59040: 29423* 1/0/1 A 142.250.195.4 (73)
18:52:57.329113 IP kube-dns.kube-system.svc.cluster.local.53 > 10.244.0.6.59040: 60374* 1/0/1 AAAA 2404:6800:4009:817::2004 (85)
18:52:57.329204 IP 10.244.0.6.45002 > lcboma-at-in-f4.1e100.net.443: Flags [S], seq 4255638006, win 64860, options [mss 1410,sackOK,TS val 3345665370 ecr 0,nop,wscale 10], length 0
18:52:57.454864 IP lcboma-at-in-f4.1e100.net.443 > 10.244.0.6.45002: Flags [S.], seq 997824921, ack 4255638007, win 65535, options [mss 1412,sackOK,TS val 2585272065 ecr 3345665370,nop,wscale 8], length 0
18:52:57.454875 IP 10.244.0.6.45002 > lcboma-at-in-f4.1e100.net.443: Flags [.], ack 1, win 64, options [nop,nop,TS val 3345665496 ecr 2585272065], length 0
18:52:57.456921 IP 10.244.0.6.45002 > lcboma-at-in-f4.1e100.net.443: Flags [P.], seq 1:1566, ack 1, win 64, options [nop,nop,TS val 3345665498 ecr 2585272065], length 1565
18:52:57.465704 IP lcboma-at-in-f4.1e100.net.443 > 10.244.0.6.45002: Flags [.], ack 1566, win 1044, options [nop,nop,TS val 2585272194 ecr 3345665498], length 0
18:52:57.465706 IP lcboma-at-in-f4.1e100.net.443 > 10.244.0.6.45002: Flags [P.], seq 1:2797, ack 1566, win 1044, options [nop,nop,TS val 2585272196 ecr 3345665498], length 2796
18:52:57.465712 IP 10.244.0.6.45002 > lcboma-at-in-f4.1e100.net.443: Flags [.], ack 2797, win 62, options [nop,nop,TS val 3345665506 ecr 2585272196], length 0
18:52:57.465713 IP lcboma-at-in-f4.1e100.net.443 > 10.244.0.6.45002: Flags [P.], seq 2797:5204, ack 1566, win 1044, options [nop,nop,TS val 2585272196 ecr 3345665498], length 2407
18:52:57.465714 IP 10.244.0.6.45002 > lcboma-at-in-f4.1e100.net.443: Flags [.], ack 5204, win 60, options [nop,nop,TS val 3345665506 ecr 2585272196], length 0
18:52:57.466677 IP 10.244.0.6.45002 > lcboma-at-in-f4.1e100.net.443: Flags [P.], seq 1566:1646, ack 5204, win 60, options [nop,nop,TS val 3345665507 ecr 2585272196], length 80
18:52:57.466851 IP 10.244.0.6.45002 > lcboma-at-in-f4.1e100.net.443: Flags [P.], seq 1646:1777, ack 5204, win 60, options [nop,nop,TS val 3345665508 ecr 2585272196], length 131
18:52:57.471132 IP lcboma-at-in-f4.1e100.net.443 > 10.244.0.6.45002: Flags [.], ack 1777, win 1044, options [nop,nop,TS val 2585272203 ecr 3345665507], length 0
18:52:57.471251 IP lcboma-at-in-f4.1e100.net.443 > 10.244.0.6.45002: Flags [P.], seq 5204:5854, ack 1777, win 1044, options [nop,nop,TS val 2585272203 ecr 3345665507], length 650
18:52:57.471419 IP 10.244.0.6.45002 > lcboma-at-in-f4.1e100.net.443: Flags [P.], seq 1777:1808, ack 5854, win 60, options [nop,nop,TS val 3345665512 ecr 2585272203], length 31
18:52:57.473292 IP lcboma-at-in-f4.1e100.net.443 > 10.244.0.6.45002: Flags [P.], seq 5854:5885, ack 1777, win 1044, options [nop,nop,TS val 2585272204 ecr 3345665507], length 31
18:52:57.508700 IP lcboma-at-in-f4.1e100.net.443 > 10.244.0.6.45002: Flags [.], ack 1808, win 1044, options [nop,nop,TS val 2585272212 ecr 3345665512], length 0
18:52:57.513844 IP 10.244.0.6.45002 > lcboma-at-in-f4.1e100.net.443: Flags [.], ack 5885, win 60, options [nop,nop,TS val 3345665555 ecr 2585272204], length 0
18:52:58.151787 IP lcboma-at-in-f4.1e100.net.443 > 10.244.0.6.45002: Flags [P.], seq 5885:6828, ack 1808, win 1044, options [nop,nop,TS val 2585272746 ecr 3345665555], length 943
18:52:58.151796 IP 10.244.0.6.45002 > lcboma-at-in-f4.1e100.net.443: Flags [.], ack 6828, win 60, options [nop,nop,TS val 3345666192 ecr 2585272746], length 0
18:52:58.151952 IP 10.244.0.6.45002 > lcboma-at-in-f4.1e100.net.443: Flags [P.], seq 1808:1847, ack 6828, win 60, options [nop,nop,TS val 3345666193 ecr 2585272746], length 39
18:52:58.152161 IP 10.244.0.6.45002 > lcboma-at-in-f4.1e100.net.443: Flags [P.], seq 1847:1895, ack 6828, win 60, options [nop,nop,TS val 3345666193 ecr 2585272746], length 48
18:52:58.152214 IP 10.244.0.6.45002 > lcboma-at-in-f4.1e100.net.443: Flags [P.], seq 1895:1919, ack 6828, win 60, options [nop,nop,TS val 3345666193 ecr 2585272746], length 24
18:52:58.153225 IP 10.244.0.6.45002 > lcboma-at-in-f4.1e100.net.443: Flags [F.], seq 1919, ack 6828, win 60, options [nop,nop,TS val 3345666194 ecr 2585272746], length 0
18:52:58.157405 IP lcboma-at-in-f4.1e100.net.443 > 10.244.0.6.45002: Flags [.], ack 1847, win 1044, options [nop,nop,TS val 2585272887 ecr 3345666193], length 0
18:52:58.157410 IP lcboma-at-in-f4.1e100.net.443 > 10.244.0.6.45002: Flags [.], ack 1895, win 1044, options [nop,nop,TS val 2585272888 ecr 3345666193], length 0
18:52:58.157412 IP lcboma-at-in-f4.1e100.net.443 > 10.244.0.6.45002: Flags [.], ack 1919, win 1044, options [nop,nop,TS val 2585272888 ecr 3345666193], length 0
18:52:58.157414 IP lcboma-at-in-f4.1e100.net.443 > 10.244.0.6.45002: Flags [F.], seq 6828, ack 1920, win 1044, options [nop,nop,TS val 2585272888 ecr 3345666194], length 0
18:52:58.157419 IP 10.244.0.6.45002 > lcboma-at-in-f4.1e100.net.443: Flags [.], ack 6829, win 60, options [nop,nop,TS val 3345666198 ecr 2585272888], length 0
18:52:59.161355 IP 10.244.0.6.58072 > kube-dns.kube-system.svc.cluster.local.53: 12078+ [1au] A? www.google.com.default.svc.cluster.local. (81)
18:52:59.161480 IP 10.244.0.6.58072 > kube-dns.kube-system.svc.cluster.local.53: 3118+ [1au] AAAA? www.google.com.default.svc.cluster.local. (81)
18:52:59.161939 IP kube-dns.kube-system.svc.cluster.local.53 > 10.244.0.6.58072: 3118 NXDomain*- 0/1/1 (174)
18:52:59.161970 IP kube-dns.kube-system.svc.cluster.local.53 > 10.244.0.6.58072: 12078 NXDomain*- 0/1/1 (174)
18:52:59.162053 IP 10.244.0.6.58072 > kube-dns.kube-system.svc.cluster.local.53: 34755+ [1au] A? www.google.com.svc.cluster.local. (61)
18:52:59.162078 IP 10.244.0.6.58072 > kube-dns.kube-system.svc.cluster.local.53: 44852+ [1au] AAAA? www.google.com.svc.cluster.local. (61)
18:52:59.162187 IP kube-dns.kube-system.svc.cluster.local.53 > 10.244.0.6.58072: 44852 NXDomain*- 0/1/1 (154)
18:52:59.162225 IP kube-dns.kube-system.svc.cluster.local.53 > 10.244.0.6.58072: 34755 NXDomain*- 0/1/1 (154)
18:52:59.162322 IP 10.244.0.6.58072 > kube-dns.kube-system.svc.cluster.local.53: 39207+ [1au] A? www.google.com.cluster.local. (57)
18:52:59.162356 IP 10.244.0.6.58072 > kube-dns.kube-system.svc.cluster.local.53: 49663+ [1au] AAAA? www.google.com.cluster.local. (57)
18:52:59.162453 IP kube-dns.kube-system.svc.cluster.local.53 > 10.244.0.6.58072: 39207 NXDomain*- 0/1/1 (150)
18:52:59.162477 IP kube-dns.kube-system.svc.cluster.local.53 > 10.244.0.6.58072: 49663 NXDomain*- 0/1/1 (150)
18:52:59.162537 IP 10.244.0.6.58072 > kube-dns.kube-system.svc.cluster.local.53: 38420+ [1au] A? www.google.com. (43)
18:52:59.162559 IP 10.244.0.6.58072 > kube-dns.kube-system.svc.cluster.local.53: 61205+ [1au] AAAA? www.google.com. (43)
18:52:59.163412 IP kube-dns.kube-system.svc.cluster.local.53 > 10.244.0.6.58072: 61205 1/0/1 AAAA 2404:6800:4009:817::2004 (85)
18:52:59.163498 IP kube-dns.kube-system.svc.cluster.local.53 > 10.244.0.6.58072: 38420 1/0/1 A 142.250.195.4 (73)
18:52:59.163609 IP 10.244.0.6.45016 > lcboma-at-in-f4.1e100.net.443: Flags [S], seq 2628082931, win 64860, options [mss 1410,sackOK,TS val 3345667204 ecr 0,nop,wscale 10], length 0
18:52:59.181884 IP lcboma-at-in-f4.1e100.net.443 > 10.244.0.6.45016: Flags [S.], seq 2021790374, ack 2628082932, win 65535, options [mss 1412,sackOK,TS val 3950019946 ecr 3345667204,nop,wscale 8], length 0
18:52:59.181922 IP 10.244.0.6.45016 > lcboma-at-in-f4.1e100.net.443: Flags [.], ack 1, win 64, options [nop,nop,TS val 3345667223 ecr 3950019946], length 0
18:52:59.187827 IP 10.244.0.6.45016 > lcboma-at-in-f4.1e100.net.443: Flags [P.], seq 1:1566, ack 1, win 64, options [nop,nop,TS val 3345667228 ecr 3950019946], length 1565
18:52:59.191245 IP lcboma-at-in-f4.1e100.net.443 > 10.244.0.6.45016: Flags [.], ack 1399, win 1045, options [nop,nop,TS val 3950019960 ecr 3345667228], length 0
18:52:59.191380 IP lcboma-at-in-f4.1e100.net.443 > 10.244.0.6.45016: Flags [.], ack 1566, win 1045, options [nop,nop,TS val 3950019960 ecr 3345667228], length 0
18:52:59.192923 IP lcboma-at-in-f4.1e100.net.443 > 10.244.0.6.45016: Flags [.], seq 1:1399, ack 1566, win 1045, options [nop,nop,TS val 3950019961 ecr 3345667228], length 1398
18:52:59.192930 IP 10.244.0.6.45016 > lcboma-at-in-f4.1e100.net.443: Flags [.], ack 1399, win 63, options [nop,nop,TS val 3345667234 ecr 3950019961], length 0
18:52:59.193427 IP lcboma-at-in-f4.1e100.net.443 > 10.244.0.6.45016: Flags [P.], seq 1399:4195, ack 1566, win 1045, options [nop,nop,TS val 3950019961 ecr 3345667228], length 2796
18:52:59.193432 IP 10.244.0.6.45016 > lcboma-at-in-f4.1e100.net.443: Flags [.], ack 4195, win 61, options [nop,nop,TS val 3345667234 ecr 3950019961], length 0
18:52:59.194776 IP lcboma-at-in-f4.1e100.net.443 > 10.244.0.6.45016: Flags [P.], seq 4195:5205, ack 1566, win 1045, options [nop,nop,TS val 3950019961 ecr 3345667228], length 1010
18:52:59.194779 IP 10.244.0.6.45016 > lcboma-at-in-f4.1e100.net.443: Flags [.], ack 5205, win 61, options [nop,nop,TS val 3345667235 ecr 3950019961], length 0
18:52:59.205309 IP 10.244.0.6.45016 > lcboma-at-in-f4.1e100.net.443: Flags [P.], seq 1566:1646, ack 5205, win 61, options [nop,nop,TS val 3345667246 ecr 3950019961], length 80
18:52:59.205455 IP 10.244.0.6.45016 > lcboma-at-in-f4.1e100.net.443: Flags [P.], seq 1646:1777, ack 5205, win 61, options [nop,nop,TS val 3345667246 ecr 3950019961], length 131
18:52:59.209722 IP lcboma-at-in-f4.1e100.net.443 > 10.244.0.6.45016: Flags [.], ack 1777, win 1045, options [nop,nop,TS val 3950019978 ecr 3345667246], length 0
18:52:59.209726 IP lcboma-at-in-f4.1e100.net.443 > 10.244.0.6.45016: Flags [P.], seq 5205:5855, ack 1777, win 1045, options [nop,nop,TS val 3950019978 ecr 3345667246], length 650
18:52:59.210037 IP 10.244.0.6.45016 > lcboma-at-in-f4.1e100.net.443: Flags [P.], seq 1777:1808, ack 5855, win 61, options [nop,nop,TS val 3345667251 ecr 3950019978], length 31
18:52:59.210755 IP lcboma-at-in-f4.1e100.net.443 > 10.244.0.6.45016: Flags [P.], seq 5855:5886, ack 1777, win 1045, options [nop,nop,TS val 3950019979 ecr 3345667246], length 31
18:52:59.217349 IP lcboma-at-in-f4.1e100.net.443 > 10.244.0.6.45016: Flags [.], ack 1808, win 1045, options [nop,nop,TS val 3950019986 ecr 3345667251], length 0
18:52:59.250876 IP 10.244.0.6.45016 > lcboma-at-in-f4.1e100.net.443: Flags [.], ack 5886, win 61, options [nop,nop,TS val 3345667292 ecr 3950019979], length 0
18:52:59.453701 IP lcboma-at-in-f4.1e100.net.443 > 10.244.0.6.45016: Flags [P.], seq 5886:6826, ack 1808, win 1045, options [nop,nop,TS val 3950020222 ecr 3345667292], length 940
18:52:59.453741 IP 10.244.0.6.45016 > lcboma-at-in-f4.1e100.net.443: Flags [.], ack 6826, win 61, options [nop,nop,TS val 3345667494 ecr 3950020222], length 0
18:52:59.454187 IP 10.244.0.6.45016 > lcboma-at-in-f4.1e100.net.443: Flags [P.], seq 1808:1847, ack 6826, win 61, options [nop,nop,TS val 3345667495 ecr 3950020222], length 39
18:52:59.454734 IP 10.244.0.6.45016 > lcboma-at-in-f4.1e100.net.443: Flags [P.], seq 1847:1895, ack 6826, win 61, options [nop,nop,TS val 3345667495 ecr 3950020222], length 48
18:52:59.454807 IP 10.244.0.6.45016 > lcboma-at-in-f4.1e100.net.443: Flags [P.], seq 1895:1919, ack 6826, win 61, options [nop,nop,TS val 3345667495 ecr 3950020222], length 24
18:52:59.457256 IP 10.244.0.6.45016 > lcboma-at-in-f4.1e100.net.443: Flags [F.], seq 1919, ack 6826, win 61, options [nop,nop,TS val 3345667498 ecr 3950020222], length 0
18:52:59.458626 IP lcboma-at-in-f4.1e100.net.443 > 10.244.0.6.45016: Flags [.], ack 1847, win 1045, options [nop,nop,TS val 3950020227 ecr 3345667495], length 0
18:52:59.458641 IP lcboma-at-in-f4.1e100.net.443 > 10.244.0.6.45016: Flags [.], ack 1895, win 1045, options [nop,nop,TS val 3950020227 ecr 3345667495], length 0
18:52:59.458645 IP lcboma-at-in-f4.1e100.net.443 > 10.244.0.6.45016: Flags [.], ack 1919, win 1045, options [nop,nop,TS val 3950020227 ecr 3345667495], length 0
18:52:59.458647 IP lcboma-at-in-f4.1e100.net.443 > 10.244.0.6.45016: Flags [F.], seq 6826, ack 1919, win 1045, options [nop,nop,TS val 3950020227 ecr 3345667495], length 0
18:52:59.458654 IP 10.244.0.6.45016 > lcboma-at-in-f4.1e100.net.443: Flags [.], ack 6827, win 61, options [nop,nop,TS val 3345667499 ecr 3950020227], length 0
18:52:59.460944 IP lcboma-at-in-f4.1e100.net.443 > 10.244.0.6.45016: Flags [.], ack 1920, win 1045, options [nop,nop,TS val 3950020230 ecr 3345667498], length 0
18:53:00.199272 ARP, Request who-has 10.244.0.6 tell 10-244-0-3.kube-dns.kube-system.svc.cluster.local, length 28
18:53:00.199289 ARP, Reply 10.244.0.6 is-at f6:66:b4:f7:82:79 (oui Unknown), length 28
18:53:00.468171 IP 10.244.0.6.60624 > kube-dns.kube-system.svc.cluster.local.53: 53275+ [1au] A? www.google.com.default.svc.cluster.local. (81)
18:53:00.468289 IP 10.244.0.6.60624 > kube-dns.kube-system.svc.cluster.local.53: 54740+ [1au] AAAA? www.google.com.default.svc.cluster.local. (81)
18:53:00.468575 IP kube-dns.kube-system.svc.cluster.local.53 > 10.244.0.6.60624: 54740 NXDomain*- 0/1/1 (174)
18:53:00.468693 IP kube-dns.kube-system.svc.cluster.local.53 > 10.244.0.6.60624: 53275 NXDomain*- 0/1/1 (174)
18:53:00.468870 IP 10.244.0.6.60624 > kube-dns.kube-system.svc.cluster.local.53: 57607+ [1au] A? www.google.com.svc.cluster.local. (61)
18:53:00.468930 IP 10.244.0.6.60624 > kube-dns.kube-system.svc.cluster.local.53: 48911+ [1au] AAAA? www.google.com.svc.cluster.local. (61)
18:53:00.469083 IP kube-dns.kube-system.svc.cluster.local.53 > 10.244.0.6.60624: 57607 NXDomain*- 0/1/1 (154)
18:53:00.469142 IP kube-dns.kube-system.svc.cluster.local.53 > 10.244.0.6.60624: 48911 NXDomain*- 0/1/1 (154)
18:53:00.469330 IP 10.244.0.6.60624 > kube-dns.kube-system.svc.cluster.local.53: 45658+ [1au] A? www.google.com.cluster.local. (57)
18:53:00.469390 IP 10.244.0.6.60624 > kube-dns.kube-system.svc.cluster.local.53: 60787+ [1au] AAAA? www.google.com.cluster.local. (57)
18:53:00.469530 IP kube-dns.kube-system.svc.cluster.local.53 > 10.244.0.6.60624: 45658 NXDomain*- 0/1/1 (150)
18:53:00.469590 IP kube-dns.kube-system.svc.cluster.local.53 > 10.244.0.6.60624: 60787 NXDomain*- 0/1/1 (150)
18:53:00.469734 IP 10.244.0.6.60624 > kube-dns.kube-system.svc.cluster.local.53: 56841+ [1au] A? www.google.com. (43)
18:53:00.469781 IP 10.244.0.6.60624 > kube-dns.kube-system.svc.cluster.local.53: 32551+ [1au] AAAA? www.google.com. (43)
18:53:00.469871 IP kube-dns.kube-system.svc.cluster.local.53 > 10.244.0.6.60624: 56841* 1/0/1 A 142.250.195.4 (73)
18:53:00.469895 IP kube-dns.kube-system.svc.cluster.local.53 > 10.244.0.6.60624: 32551* 1/0/1 AAAA 2404:6800:4009:817::2004 (85)
18:53:00.470203 IP 10.244.0.6.45020 > lcboma-at-in-f4.1e100.net.443: Flags [S], seq 727659594, win 64860, options [mss 1410,sackOK,TS val 3345668511 ecr 0,nop,wscale 10], length 0
18:53:00.605601 IP lcboma-at-in-f4.1e100.net.443 > 10.244.0.6.45020: Flags [S.], seq 4021129056, ack 727659595, win 65535, options [mss 1412,sackOK,TS val 3166971201 ecr 3345668511,nop,wscale 8], length 0
18:53:00.605611 IP 10.244.0.6.45020 > lcboma-at-in-f4.1e100.net.443: Flags [.], ack 1, win 64, options [nop,nop,TS val 3345668646 ecr 3166971201], length 0
18:53:00.607562 IP 10.244.0.6.45020 > lcboma-at-in-f4.1e100.net.443: Flags [P.], seq 1:1566, ack 1, win 64, options [nop,nop,TS val 3345668648 ecr 3166971201], length 1565
18:53:00.621002 IP lcboma-at-in-f4.1e100.net.443 > 10.244.0.6.45020: Flags [.], ack 1566, win 1044, options [nop,nop,TS val 3166971342 ecr 3345668648], length 0
18:53:00.621006 IP lcboma-at-in-f4.1e100.net.443 > 10.244.0.6.45020: Flags [P.], seq 1:2797, ack 1566, win 1044, options [nop,nop,TS val 3166971343 ecr 3345668648], length 2796
18:53:00.621011 IP 10.244.0.6.45020 > lcboma-at-in-f4.1e100.net.443: Flags [.], ack 2797, win 62, options [nop,nop,TS val 3345668662 ecr 3166971343], length 0
18:53:00.621012 IP lcboma-at-in-f4.1e100.net.443 > 10.244.0.6.45020: Flags [P.], seq 2797:5204, ack 1566, win 1044, options [nop,nop,TS val 3166971343 ecr 3345668648], length 2407
18:53:00.621014 IP 10.244.0.6.45020 > lcboma-at-in-f4.1e100.net.443: Flags [.], ack 5204, win 60, options [nop,nop,TS val 3345668662 ecr 3166971343], length 0
18:53:00.621951 IP 10.244.0.6.45020 > lcboma-at-in-f4.1e100.net.443: Flags [P.], seq 1566:1646, ack 5204, win 60, options [nop,nop,TS val 3345668663 ecr 3166971343], length 80
18:53:00.622076 IP 10.244.0.6.45020 > lcboma-at-in-f4.1e100.net.443: Flags [P.], seq 1646:1777, ack 5204, win 60, options [nop,nop,TS val 3345668663 ecr 3166971343], length 131
18:53:00.648704 IP lcboma-at-in-f4.1e100.net.443 > 10.244.0.6.45020: Flags [.], ack 1777, win 1044, options [nop,nop,TS val 3166971352 ecr 3345668663], length 0
18:53:00.648718 IP lcboma-at-in-f4.1e100.net.443 > 10.244.0.6.45020: Flags [P.], seq 5204:5854, ack 1777, win 1044, options [nop,nop,TS val 3166971352 ecr 3345668663], length 650
18:53:00.648728 IP lcboma-at-in-f4.1e100.net.443 > 10.244.0.6.45020: Flags [P.], seq 5854:5885, ack 1777, win 1044, options [nop,nop,TS val 3166971354 ecr 3345668663], length 31
18:53:00.648813 IP 10.244.0.6.45020 > lcboma-at-in-f4.1e100.net.443: Flags [.], ack 5885, win 60, options [nop,nop,TS val 3345668689 ecr 3166971352], length 0
18:53:00.649451 IP 10.244.0.6.45020 > lcboma-at-in-f4.1e100.net.443: Flags [P.], seq 1777:1808, ack 5885, win 60, options [nop,nop,TS val 3345668690 ecr 3166971352], length 31
18:53:00.657125 IP lcboma-at-in-f4.1e100.net.443 > 10.244.0.6.45020: Flags [.], ack 1808, win 1044, options [nop,nop,TS val 3166971383 ecr 3345668690], length 0
18:53:01.657211 IP lcboma-at-in-f4.1e100.net.443 > 10.244.0.6.45020: Flags [P.], seq 5885:6826, ack 1808, win 1044, options [nop,nop,TS val 3166971972 ecr 3345668690], length 941
18:53:01.657229 IP lcboma-at-in-f4.1e100.net.443 > 10.244.0.6.45020: Flags [P.], seq 5885:6826, ack 1808, win 1044, options [nop,nop,TS val 3166972355 ecr 3345668690], length 941
18:53:01.657238 IP 10.244.0.6.45020 > lcboma-at-in-f4.1e100.net.443: Flags [.], ack 6826, win 60, options [nop,nop,TS val 3345669698 ecr 3166972355,nop,nop,sack 1 {5885:6826}], length 0
18:53:01.657490 IP 10.244.0.6.45020 > lcboma-at-in-f4.1e100.net.443: Flags [P.], seq 1808:1847, ack 6826, win 60, options [nop,nop,TS val 3345669698 ecr 3166972355], length 39
18:53:01.657951 IP 10.244.0.6.45020 > lcboma-at-in-f4.1e100.net.443: Flags [P.], seq 1847:1895, ack 6826, win 60, options [nop,nop,TS val 3345669699 ecr 3166972355], length 48
18:53:01.658020 IP 10.244.0.6.45020 > lcboma-at-in-f4.1e100.net.443: Flags [P.], seq 1895:1919, ack 6826, win 60, options [nop,nop,TS val 3345669699 ecr 3166972355], length 24
18:53:01.659565 IP 10.244.0.6.45020 > lcboma-at-in-f4.1e100.net.443: Flags [F.], seq 1919, ack 6826, win 60, options [nop,nop,TS val 3345669700 ecr 3166972355], length 0
18:53:01.854880 IP 10.244.0.6.45020 > lcboma-at-in-f4.1e100.net.443: Flags [F.], seq 1919, ack 6826, win 60, options [nop,nop,TS val 3345669896 ecr 3166972355], length 0
18:53:01.988268 IP lcboma-at-in-f4.1e100.net.443 > 10.244.0.6.45020: Flags [.], ack 1847, win 1044, options [nop,nop,TS val 3166972388 ecr 3345669698], length 0
18:53:01.988287 IP lcboma-at-in-f4.1e100.net.443 > 10.244.0.6.45020: Flags [.], ack 1895, win 1044, options [nop,nop,TS val 3166972388 ecr 3345669699], length 0
18:53:01.988302 IP lcboma-at-in-f4.1e100.net.443 > 10.244.0.6.45020: Flags [.], ack 1919, win 1044, options [nop,nop,TS val 3166972388 ecr 3345669699], length 0
18:53:01.988311 IP lcboma-at-in-f4.1e100.net.443 > 10.244.0.6.45020: Flags [F.], seq 6826, ack 1920, win 1044, options [nop,nop,TS val 3166972388 ecr 3345669700], length 0
18:53:01.988331 IP 10.244.0.6.45020 > lcboma-at-in-f4.1e100.net.443: Flags [.], ack 6827, win 60, options [nop,nop,TS val 3345670029 ecr 3166972388], length 0
18:53:01.988351 IP lcboma-at-in-f4.1e100.net.443 > 10.244.0.6.45020: Flags [.], ack 1920, win 1044, options [nop,nop,TS val 3166972680 ecr 3345669896,nop,nop,sack 1 {1919:1920}], length 0
18:53:02.669186 IP 10.244.0.6.51553 > kube-dns.kube-system.svc.cluster.local.53: 5711+ [1au] A? www.google.com.default.svc.cluster.local. (81)
18:53:02.669310 IP 10.244.0.6.51553 > kube-dns.kube-system.svc.cluster.local.53: 59061+ [1au] AAAA? www.google.com.default.svc.cluster.local. (81)
18:53:02.669658 IP kube-dns.kube-system.svc.cluster.local.53 > 10.244.0.6.51553: 5711 NXDomain*- 0/1/1 (174)
18:53:02.669906 IP kube-dns.kube-system.svc.cluster.local.53 > 10.244.0.6.51553: 59061 NXDomain*- 0/1/1 (174)
18:53:02.669999 IP 10.244.0.6.51553 > kube-dns.kube-system.svc.cluster.local.53: 27481+ [1au] A? www.google.com.svc.cluster.local. (61)
18:53:02.670053 IP 10.244.0.6.51553 > kube-dns.kube-system.svc.cluster.local.53: 32332+ [1au] AAAA? www.google.com.svc.cluster.local. (61)
18:53:02.670171 IP kube-dns.kube-system.svc.cluster.local.53 > 10.244.0.6.51553: 32332 NXDomain*- 0/1/1 (154)
18:53:02.670239 IP kube-dns.kube-system.svc.cluster.local.53 > 10.244.0.6.51553: 27481 NXDomain*- 0/1/1 (154)
18:53:02.670347 IP 10.244.0.6.51553 > kube-dns.kube-system.svc.cluster.local.53: 44049+ [1au] A? www.google.com.cluster.local. (57)
18:53:02.670384 IP 10.244.0.6.51553 > kube-dns.kube-system.svc.cluster.local.53: 19849+ [1au] AAAA? www.google.com.cluster.local. (57)
18:53:02.670489 IP kube-dns.kube-system.svc.cluster.local.53 > 10.244.0.6.51553: 44049 NXDomain*- 0/1/1 (150)
18:53:02.670549 IP kube-dns.kube-system.svc.cluster.local.53 > 10.244.0.6.51553: 19849 NXDomain*- 0/1/1 (150)
18:53:02.670612 IP 10.244.0.6.51553 > kube-dns.kube-system.svc.cluster.local.53: 20638+ [1au] A? www.google.com. (43)
18:53:02.670635 IP 10.244.0.6.51553 > kube-dns.kube-system.svc.cluster.local.53: 34666+ [1au] AAAA? www.google.com. (43)
18:53:02.670677 IP kube-dns.kube-system.svc.cluster.local.53 > 10.244.0.6.51553: 20638* 1/0/1 A 142.250.195.4 (73)
18:53:02.670695 IP kube-dns.kube-system.svc.cluster.local.53 > 10.244.0.6.51553: 34666* 1/0/1 AAAA 2404:6800:4009:817::2004 (85)
18:53:02.670860 IP 10.244.0.6.45026 > lcboma-at-in-f4.1e100.net.443: Flags [S], seq 2982607542, win 64860, options [mss 1410,sackOK,TS val 3345670712 ecr 0,nop,wscale 10], length 0
18:53:02.778766 IP lcboma-at-in-f4.1e100.net.443 > 10.244.0.6.45026: Flags [S.], seq 4283162349, ack 2982607543, win 65535, options [mss 1412,sackOK,TS val 2511961260 ecr 3345670712,nop,wscale 8], length 0
18:53:02.778790 IP 10.244.0.6.45026 > lcboma-at-in-f4.1e100.net.443: Flags [.], ack 1, win 64, options [nop,nop,TS val 3345670819 ecr 2511961260], length 0
18:53:02.781315 IP 10.244.0.6.45026 > lcboma-at-in-f4.1e100.net.443: Flags [P.], seq 1:1566, ack 1, win 64, options [nop,nop,TS val 3345670822 ecr 2511961260], length 1565
18:53:02.787471 IP lcboma-at-in-f4.1e100.net.443 > 10.244.0.6.45026: Flags [.], ack 1566, win 1044, options [nop,nop,TS val 2511961273 ecr 3345670822], length 0
18:53:02.792512 IP lcboma-at-in-f4.1e100.net.443 > 10.244.0.6.45026: Flags [P.], seq 1:4195, ack 1566, win 1044, options [nop,nop,TS val 2511961275 ecr 3345670822], length 4194
18:53:02.792519 IP 10.244.0.6.45026 > lcboma-at-in-f4.1e100.net.443: Flags [.], ack 4195, win 60, options [nop,nop,TS val 3345670833 ecr 2511961275], length 0
18:53:02.792520 IP lcboma-at-in-f4.1e100.net.443 > 10.244.0.6.45026: Flags [P.], seq 4195:5205, ack 1566, win 1044, options [nop,nop,TS val 2511961275 ecr 3345670822], length 1010
18:53:02.792522 IP 10.244.0.6.45026 > lcboma-at-in-f4.1e100.net.443: Flags [.], ack 5205, win 60, options [nop,nop,TS val 3345670833 ecr 2511961275], length 0
18:53:02.793388 IP 10.244.0.6.45026 > lcboma-at-in-f4.1e100.net.443: Flags [P.], seq 1566:1646, ack 5205, win 60, options [nop,nop,TS val 3345670834 ecr 2511961275], length 80
18:53:02.793495 IP 10.244.0.6.45026 > lcboma-at-in-f4.1e100.net.443: Flags [P.], seq 1646:1777, ack 5205, win 60, options [nop,nop,TS val 3345670834 ecr 2511961275], length 131
18:53:02.796718 IP lcboma-at-in-f4.1e100.net.443 > 10.244.0.6.45026: Flags [.], ack 1777, win 1044, options [nop,nop,TS val 2511961283 ecr 3345670834], length 0
18:53:02.797681 IP lcboma-at-in-f4.1e100.net.443 > 10.244.0.6.45026: Flags [P.], seq 5205:5855, ack 1777, win 1044, options [nop,nop,TS val 2511961283 ecr 3345670834], length 650
18:53:02.797684 IP lcboma-at-in-f4.1e100.net.443 > 10.244.0.6.45026: Flags [P.], seq 5855:5886, ack 1777, win 1044, options [nop,nop,TS val 2511961284 ecr 3345670834], length 31
18:53:02.797694 IP 10.244.0.6.45026 > lcboma-at-in-f4.1e100.net.443: Flags [.], ack 5886, win 60, options [nop,nop,TS val 3345670838 ecr 2511961283], length 0
18:53:02.797797 IP 10.244.0.6.45026 > lcboma-at-in-f4.1e100.net.443: Flags [P.], seq 1777:1808, ack 5886, win 60, options [nop,nop,TS val 3345670838 ecr 2511961283], length 31
18:53:02.807052 IP lcboma-at-in-f4.1e100.net.443 > 10.244.0.6.45026: Flags [.], ack 1808, win 1044, options [nop,nop,TS val 2511961293 ecr 3345670838], length 0
18:53:03.184900 IP lcboma-at-in-f4.1e100.net.443 > 10.244.0.6.45026: Flags [P.], seq 5886:6825, ack 1808, win 1044, options [nop,nop,TS val 2511961368 ecr 3345670838], length 939
18:53:03.185206 IP 10.244.0.6.45026 > lcboma-at-in-f4.1e100.net.443: Flags [P.], seq 1808:1847, ack 6825, win 60, options [nop,nop,TS val 3345671226 ecr 2511961368], length 39
18:53:03.185616 IP 10.244.0.6.45026 > lcboma-at-in-f4.1e100.net.443: Flags [P.], seq 1847:1895, ack 6825, win 60, options [nop,nop,TS val 3345671226 ecr 2511961368], length 48
18:53:03.185671 IP 10.244.0.6.45026 > lcboma-at-in-f4.1e100.net.443: Flags [P.], seq 1895:1919, ack 6825, win 60, options [nop,nop,TS val 3345671226 ecr 2511961368], length 24
18:53:03.187700 IP 10.244.0.6.45026 > lcboma-at-in-f4.1e100.net.443: Flags [F.], seq 1919, ack 6825, win 60, options [nop,nop,TS val 3345671228 ecr 2511961368], length 0
18:53:03.342850 IP 10.244.0.6.45026 > lcboma-at-in-f4.1e100.net.443: Flags [F.], seq 1919, ack 6825, win 60, options [nop,nop,TS val 3345671384 ecr 2511961368], length 0
18:53:03.390489 IP lcboma-at-in-f4.1e100.net.443 > 10.244.0.6.45026: Flags [P.], seq 5886:6825, ack 1808, win 1044, options [nop,nop,TS val 2511961583 ecr 3345670838], length 939
18:53:03.390494 IP 10.244.0.6.45026 > lcboma-at-in-f4.1e100.net.443: Flags [.], ack 6825, win 60, options [nop,nop,TS val 3345671431 ecr 2511961583,nop,nop,sack 1 {5886:6825}], length 0
18:53:03.390495 IP lcboma-at-in-f4.1e100.net.443 > 10.244.0.6.45026: Flags [.], ack 1847, win 1044, options [nop,nop,TS val 2511961675 ecr 3345671226], length 0
18:53:03.390498 IP lcboma-at-in-f4.1e100.net.443 > 10.244.0.6.45026: Flags [.], ack 1895, win 1044, options [nop,nop,TS val 2511961678 ecr 3345671226], length 0
18:53:03.390499 IP lcboma-at-in-f4.1e100.net.443 > 10.244.0.6.45026: Flags [.], ack 1919, win 1044, options [nop,nop,TS val 2511961678 ecr 3345671226], length 0
18:53:03.390500 IP lcboma-at-in-f4.1e100.net.443 > 10.244.0.6.45026: Flags [F.], seq 6825, ack 1920, win 1044, options [nop,nop,TS val 2511961679 ecr 3345671228], length 0
18:53:03.390503 IP 10.244.0.6.45026 > lcboma-at-in-f4.1e100.net.443: Flags [.], ack 6826, win 60, options [nop,nop,TS val 3345671431 ecr 2511961679], length 0
18:53:04.198069 IP 10.244.0.6.35568 > kube-dns.kube-system.svc.cluster.local.53: 1938+ [1au] A? www.google.com.default.svc.cluster.local. (81)
18:53:04.198192 IP 10.244.0.6.35568 > kube-dns.kube-system.svc.cluster.local.53: 16202+ [1au] AAAA? www.google.com.default.svc.cluster.local. (81)
18:53:04.198466 IP kube-dns.kube-system.svc.cluster.local.53 > 10.244.0.6.35568: 16202 NXDomain*- 0/1/1 (174)
18:53:04.198516 IP kube-dns.kube-system.svc.cluster.local.53 > 10.244.0.6.35568: 1938 NXDomain*- 0/1/1 (174)
18:53:04.198633 IP 10.244.0.6.35568 > kube-dns.kube-system.svc.cluster.local.53: 13549+ [1au] A? www.google.com.svc.cluster.local. (61)
18:53:04.198669 IP 10.244.0.6.35568 > kube-dns.kube-system.svc.cluster.local.53: 45441+ [1au] AAAA? www.google.com.svc.cluster.local. (61)
18:53:04.198756 IP kube-dns.kube-system.svc.cluster.local.53 > 10.244.0.6.35568: 13549 NXDomain*- 0/1/1 (154)
18:53:04.198872 IP kube-dns.kube-system.svc.cluster.local.53 > 10.244.0.6.35568: 45441 NXDomain*- 0/1/1 (154)
18:53:04.198996 IP 10.244.0.6.35568 > kube-dns.kube-system.svc.cluster.local.53: 51653+ [1au] A? www.google.com.cluster.local. (57)
18:53:04.199052 IP 10.244.0.6.35568 > kube-dns.kube-system.svc.cluster.local.53: 23239+ [1au] AAAA? www.google.com.cluster.local. (57)
18:53:04.199161 IP kube-dns.kube-system.svc.cluster.local.53 > 10.244.0.6.35568: 51653 NXDomain*- 0/1/1 (150)
18:53:04.199207 IP kube-dns.kube-system.svc.cluster.local.53 > 10.244.0.6.35568: 23239 NXDomain*- 0/1/1 (150)
18:53:04.199273 IP 10.244.0.6.35568 > kube-dns.kube-system.svc.cluster.local.53: 31349+ [1au] A? www.google.com. (43)
18:53:04.199296 IP 10.244.0.6.35568 > kube-dns.kube-system.svc.cluster.local.53: 9251+ [1au] AAAA? www.google.com. (43)
18:53:04.199352 IP kube-dns.kube-system.svc.cluster.local.53 > 10.244.0.6.35568: 31349* 1/0/1 A 142.250.195.4 (73)
18:53:04.199369 IP kube-dns.kube-system.svc.cluster.local.53 > 10.244.0.6.35568: 9251* 1/0/1 AAAA 2404:6800:4009:817::2004 (85)
18:53:04.199552 IP 10.244.0.6.57534 > lcboma-at-in-f4.1e100.net.443: Flags [S], seq 2490933286, win 64860, options [mss 1410,sackOK,TS val 3345672240 ecr 0,nop,wscale 10], length 0
18:53:04.231342 IP lcboma-at-in-f4.1e100.net.443 > 10.244.0.6.45026: Flags [.], ack 1920, win 1044, options [nop,nop,TS val 2511961874 ecr 3345671384,nop,nop,sack 1 {1919:1920}], length 0
18:53:04.231343 IP lcboma-at-in-f4.1e100.net.443 > 10.244.0.6.57534: Flags [S.], seq 2183828082, ack 2490933287, win 65535, options [mss 1412,sackOK,TS val 4200508393 ecr 3345672240,nop,wscale 8], length 0
18:53:04.231381 IP 10.244.0.6.57534 > lcboma-at-in-f4.1e100.net.443: Flags [.], ack 1, win 64, options [nop,nop,TS val 3345672272 ecr 4200508393], length 0
18:53:04.236354 IP 10.244.0.6.57534 > lcboma-at-in-f4.1e100.net.443: Flags [P.], seq 1:1566, ack 1, win 64, options [nop,nop,TS val 3345672277 ecr 4200508393], length 1565
18:53:04.243698 IP lcboma-at-in-f4.1e100.net.443 > 10.244.0.6.57534: Flags [.], ack 1566, win 1044, options [nop,nop,TS val 4200508408 ecr 3345672277], length 0
18:53:04.243711 IP lcboma-at-in-f4.1e100.net.443 > 10.244.0.6.57534: Flags [.], seq 1:1399, ack 1566, win 1044, options [nop,nop,TS val 4200508410 ecr 3345672277], length 1398
18:53:04.243719 IP 10.244.0.6.57534 > lcboma-at-in-f4.1e100.net.443: Flags [.], ack 1399, win 63, options [nop,nop,TS val 3345672284 ecr 4200508410], length 0
18:53:04.244716 IP lcboma-at-in-f4.1e100.net.443 > 10.244.0.6.57534: Flags [P.], seq 1399:2797, ack 1566, win 1044, options [nop,nop,TS val 4200508410 ecr 3345672277], length 1398
18:53:04.244726 IP 10.244.0.6.57534 > lcboma-at-in-f4.1e100.net.443: Flags [.], ack 2797, win 62, options [nop,nop,TS val 3345672285 ecr 4200508410], length 0
18:53:04.244728 IP lcboma-at-in-f4.1e100.net.443 > 10.244.0.6.57534: Flags [P.], seq 2797:5204, ack 1566, win 1044, options [nop,nop,TS val 4200508410 ecr 3345672277], length 2407
18:53:04.244732 IP 10.244.0.6.57534 > lcboma-at-in-f4.1e100.net.443: Flags [.], ack 5204, win 60, options [nop,nop,TS val 3345672285 ecr 4200508410], length 0
18:53:04.253594 IP 10.244.0.6.57534 > lcboma-at-in-f4.1e100.net.443: Flags [P.], seq 1566:1646, ack 5204, win 60, options [nop,nop,TS val 3345672294 ecr 4200508410], length 80
18:53:04.253854 IP 10.244.0.6.57534 > lcboma-at-in-f4.1e100.net.443: Flags [P.], seq 1646:1777, ack 5204, win 60, options [nop,nop,TS val 3345672295 ecr 4200508410], length 131
18:53:04.256748 IP lcboma-at-in-f4.1e100.net.443 > 10.244.0.6.57534: Flags [.], ack 1777, win 1044, options [nop,nop,TS val 4200508426 ecr 3345672294], length 0
18:53:04.257702 IP lcboma-at-in-f4.1e100.net.443 > 10.244.0.6.57534: Flags [P.], seq 5204:5854, ack 1777, win 1044, options [nop,nop,TS val 4200508426 ecr 3345672294], length 650
18:53:04.258098 IP 10.244.0.6.57534 > lcboma-at-in-f4.1e100.net.443: Flags [P.], seq 1777:1808, ack 5854, win 60, options [nop,nop,TS val 3345672299 ecr 4200508426], length 31
18:53:04.258175 IP lcboma-at-in-f4.1e100.net.443 > 10.244.0.6.57534: Flags [P.], seq 5854:5885, ack 1777, win 1044, options [nop,nop,TS val 4200508427 ecr 3345672294], length 31
18:53:04.265724 IP lcboma-at-in-f4.1e100.net.443 > 10.244.0.6.57534: Flags [.], ack 1808, win 1044, options [nop,nop,TS val 4200508435 ecr 3345672299], length 0
18:53:04.298870 IP 10.244.0.6.57534 > lcboma-at-in-f4.1e100.net.443: Flags [.], ack 5885, win 60, options [nop,nop,TS val 3345672340 ecr 4200508427], length 0
18:53:05.013536 IP lcboma-at-in-f4.1e100.net.443 > 10.244.0.6.57534: Flags [P.], seq 5885:6823, ack 1808, win 1044, options [nop,nop,TS val 4200509136 ecr 3345672340], length 938
18:53:05.013543 IP 10.244.0.6.57534 > lcboma-at-in-f4.1e100.net.443: Flags [.], ack 6823, win 60, options [nop,nop,TS val 3345673054 ecr 4200509136], length 0
18:53:05.013715 IP 10.244.0.6.57534 > lcboma-at-in-f4.1e100.net.443: Flags [P.], seq 1808:1847, ack 6823, win 60, options [nop,nop,TS val 3345673054 ecr 4200509136], length 39
18:53:05.013878 IP 10.244.0.6.57534 > lcboma-at-in-f4.1e100.net.443: Flags [P.], seq 1847:1895, ack 6823, win 60, options [nop,nop,TS val 3345673055 ecr 4200509136], length 48
18:53:05.013898 IP 10.244.0.6.57534 > lcboma-at-in-f4.1e100.net.443: Flags [P.], seq 1895:1919, ack 6823, win 60, options [nop,nop,TS val 3345673055 ecr 4200509136], length 24
18:53:05.014687 IP 10.244.0.6.57534 > lcboma-at-in-f4.1e100.net.443: Flags [F.], seq 1919, ack 6823, win 60, options [nop,nop,TS val 3345673055 ecr 4200509136], length 0
18:53:05.018438 IP lcboma-at-in-f4.1e100.net.443 > 10.244.0.6.57534: Flags [P.], seq 5885:6823, ack 1808, win 1044, options [nop,nop,TS val 4200508671 ecr 3345672340], length 938
18:53:05.018440 IP 10.244.0.6.57534 > lcboma-at-in-f4.1e100.net.443: Flags [.], ack 6823, win 60, options [nop,nop,TS val 3345673059 ecr 4200509136,nop,nop,sack 1 {5885:6823}], length 0
18:53:05.018441 IP lcboma-at-in-f4.1e100.net.443 > 10.244.0.6.57534: Flags [P.], seq 5885:6823, ack 1808, win 1044, options [nop,nop,TS val 4200508904 ecr 3345672340], length 938
18:53:05.018442 IP 10.244.0.6.57534 > lcboma-at-in-f4.1e100.net.443: Flags [.], ack 6823, win 60, options [nop,nop,TS val 3345673059 ecr 4200509136,nop,nop,sack 1 {5885:6823}], length 0
18:53:05.027221 IP lcboma-at-in-f4.1e100.net.443 > 10.244.0.6.57534: Flags [.], ack 1847, win 1044, options [nop,nop,TS val 4200509195 ecr 3345673054], length 0
18:53:05.027224 IP lcboma-at-in-f4.1e100.net.443 > 10.244.0.6.57534: Flags [.], ack 1895, win 1044, options [nop,nop,TS val 4200509195 ecr 3345673055], length 0
18:53:05.027226 IP lcboma-at-in-f4.1e100.net.443 > 10.244.0.6.57534: Flags [.], ack 1919, win 1044, options [nop,nop,TS val 4200509195 ecr 3345673055], length 0
18:53:05.027227 IP lcboma-at-in-f4.1e100.net.443 > 10.244.0.6.57534: Flags [F.], seq 6823, ack 1920, win 1044, options [nop,nop,TS val 4200509195 ecr 3345673055], length 0
18:53:05.027230 IP 10.244.0.6.57534 > lcboma-at-in-f4.1e100.net.443: Flags [.], ack 6824, win 60, options [nop,nop,TS val 3345673068 ecr 4200509195], length 0
18:53:06.018979 IP 10.244.0.6.51034 > kube-dns.kube-system.svc.cluster.local.53: 29803+ [1au] A? www.google.com.default.svc.cluster.local. (81)
18:53:06.019038 IP 10.244.0.6.51034 > kube-dns.kube-system.svc.cluster.local.53: 37669+ [1au] AAAA? www.google.com.default.svc.cluster.local. (81)
18:53:06.019197 IP kube-dns.kube-system.svc.cluster.local.53 > 10.244.0.6.51034: 37669 NXDomain*- 0/1/1 (174)
18:53:06.019225 IP kube-dns.kube-system.svc.cluster.local.53 > 10.244.0.6.51034: 29803 NXDomain*- 0/1/1 (174)
18:53:06.019267 IP 10.244.0.6.51034 > kube-dns.kube-system.svc.cluster.local.53: 22206+ [1au] A? www.google.com.svc.cluster.local. (61)
18:53:06.019281 IP 10.244.0.6.51034 > kube-dns.kube-system.svc.cluster.local.53: 49296+ [1au] AAAA? www.google.com.svc.cluster.local. (61)
18:53:06.019318 IP kube-dns.kube-system.svc.cluster.local.53 > 10.244.0.6.51034: 22206 NXDomain*- 0/1/1 (154)
18:53:06.019367 IP kube-dns.kube-system.svc.cluster.local.53 > 10.244.0.6.51034: 49296 NXDomain*- 0/1/1 (154)
18:53:06.019399 IP 10.244.0.6.51034 > kube-dns.kube-system.svc.cluster.local.53: 17650+ [1au] A? www.google.com.cluster.local. (57)
18:53:06.019411 IP 10.244.0.6.51034 > kube-dns.kube-system.svc.cluster.local.53: 11776+ [1au] AAAA? www.google.com.cluster.local. (57)
18:53:06.019440 IP kube-dns.kube-system.svc.cluster.local.53 > 10.244.0.6.51034: 17650 NXDomain*- 0/1/1 (150)
18:53:06.019456 IP kube-dns.kube-system.svc.cluster.local.53 > 10.244.0.6.51034: 11776 NXDomain*- 0/1/1 (150)
18:53:06.019481 IP 10.244.0.6.51034 > kube-dns.kube-system.svc.cluster.local.53: 35896+ [1au] A? www.google.com. (43)
18:53:06.019490 IP 10.244.0.6.51034 > kube-dns.kube-system.svc.cluster.local.53: 59747+ [1au] AAAA? www.google.com. (43)
18:53:06.019546 IP kube-dns.kube-system.svc.cluster.local.53 > 10.244.0.6.51034: 59747* 1/0/1 AAAA 2404:6800:4009:817::2004 (85)
18:53:06.019575 IP kube-dns.kube-system.svc.cluster.local.53 > 10.244.0.6.51034: 35896* 1/0/1 A 142.250.195.4 (73)
18:53:06.019646 IP 10.244.0.6.57550 > lcboma-at-in-f4.1e100.net.443: Flags [S], seq 1145504696, win 64860, options [mss 1410,sackOK,TS val 3345674060 ecr 0,nop,wscale 10], length 0
18:53:06.022141 IP lcboma-at-in-f4.1e100.net.443 > 10.244.0.6.57550: Flags [S.], seq 1480002835, ack 1145504697, win 65535, options [mss 1412,sackOK,TS val 3106257221 ecr 3345674060,nop,wscale 8], length 0
18:53:06.022156 IP 10.244.0.6.57550 > lcboma-at-in-f4.1e100.net.443: Flags [.], ack 1, win 64, options [nop,nop,TS val 3345674063 ecr 3106257221], length 0
18:53:06.024148 IP 10.244.0.6.57550 > lcboma-at-in-f4.1e100.net.443: Flags [P.], seq 1:1566, ack 1, win 64, options [nop,nop,TS val 3345674065 ecr 3106257221], length 1565
18:53:06.031840 IP 10.244.0.6.57550 > lcboma-at-in-f4.1e100.net.443: Flags [P.], seq 1399:1566, ack 1, win 64, options [nop,nop,TS val 3345674073 ecr 3106257221], length 167
18:53:06.032987 IP lcboma-at-in-f4.1e100.net.443 > 10.244.0.6.57550: Flags [.], ack 1399, win 1045, options [nop,nop,TS val 3106257232 ecr 3345674065], length 0
18:53:06.033906 IP lcboma-at-in-f4.1e100.net.443 > 10.244.0.6.57550: Flags [.], ack 1566, win 1045, options [nop,nop,TS val 3106257233 ecr 3345674065], length 0
